{"case_id":"requests-7025","annotator_id":"requests-7025-b","annotation_status":"COMPLETE","source":{"base_sha":"1c49660b84c88eeb2695796ce4a68903c00e00c5","head_sha":"7d8df1df573a01f20a80994685e9f6c375f9c63f","repository_access_mode":"FROZEN_REPOSITORY_READ_ONLY"},"findings":[],"missing_context_requests":[],"review_summary":"Completed the frozen commit-range review. The PR only updates the fully pinned pypa/gh-action-pypi-publish revision from the commit identified as version 1.12.4 to the commit identified as version 1.13.0 in .github/workflows/publish.yml. The surrounding publish job remains internally consistent, and the repository provides no concrete evidence of a regression or actionable defect caused by this change. No sufficiently supported issue was found."}