{"case_id":"pytest-15057","annotator_id":"pytest-15057-a","annotation_status":"COMPLETE","source":{"base_sha":"56a92c19d4a71152c594726efc9deb5f0e126e99","head_sha":"2ba72a3a5e79e14ae477009987710f24060e69a1","repository_access_mode":"FROZEN_REPOSITORY_READ_ONLY"},"findings":[],"missing_context_requests":[],"review_summary":"Completed a repository-grounded review of the exact base-to-head diff. The PR only removes a redundant output-level deduplication guard from `src/_pytest/fixtures.py`; the current fixture manager stores each registration in one mutually exclusive node-based or legacy nodeid-based collection, so `_get_all_fixture_defs()` does not inherently emit the same registration through both paths. Existing tests also cover fixtures with identical names in different locations, which must remain separately displayed. No sufficiently supported technical issue was found."}