{"case_id":"requests-6963","annotator_id":"requests-6963-a","annotation_status":"COMPLETE","source":{"base_sha":"7bc45877a86192af77645e156eb3744f95b47dae","head_sha":"92bab7d1142db0c807060577233568e5f7734c9b","repository_access_mode":"FROZEN_REPOSITORY_READ_ONLY"},"findings":[],"missing_context_requests":[],"review_summary":"Reviewed the complete base-to-head diff in the frozen repository. The change adds focused netrc authentication regression tests and removes an obsolete KeyError workaround around os.path.expanduser for the supported Python versions. No sufficiently supported technical issue caused by or materially relevant to this PR was found."}