{"case_id":"requests-6963","annotator_id":"requests-6963-b","annotation_status":"COMPLETE","source":{"base_sha":"7bc45877a86192af77645e156eb3744f95b47dae","head_sha":"92bab7d1142db0c807060577233568e5f7734c9b","repository_access_mode":"FROZEN_REPOSITORY_READ_ONLY"},"findings":[{"annotation_finding_id":"requests-6963-b-001","issue_exists":true,"should_comment":true,"category":"error-handling-regression","path":"src/requests/utils.py","start_line":221,"end_line":223,"severity":"medium","evidence_refs":[{"path":"src/requests/utils.py","start_line":221,"end_line":223,"revision":"92bab7d1142db0c807060577233568e5f7734c9b","description":"The default netrc search now calls os.path.expanduser directly without handling failure."},{"path":"src/requests/utils.py","start_line":222,"end_line":228,"revision":"7bc45877a86192af77645e156eb3744f95b47dae","description":"The base revision caught KeyError from expanduser when HOME was unset and the current UID could not be resolved, returning without netrc authentication."},{"path":"src/requests/sessions.py","start_line":478,"end_line":481,"revision":"92bab7d1142db0c807060577233568e5f7734c9b","description":"Normal request preparation invokes get_netrc_auth when trust_env is enabled and no explicit authentication is configured."}],"technical_rationale":"On POSIX, expanduser('~/.netrc') falls back to pwd.getpwuid when HOME is absent, and that lookup can raise KeyError for an unmapped UID, a real configuration in minimal or user-namespaced containers. The removed handler therefore lets ordinary request preparation fail before any network operation. This behavior is unrelated to the URL-parsing vulnerability covered by the newly added test and regresses a deliberately documented supported environment from the base revision.","comment_usefulness_rationale":"A comment is actionable because retaining the narrow KeyError guard does not interfere with the security fix, and a regression test can preserve both behaviors."}],"missing_context_requests":[],"review_summary":"Completed the frozen base-to-head review. Found one supported robustness regression: removal of the expanduser KeyError guard can make normal requests fail in environments with neither HOME nor a passwd entry for the process UID."}