{"case_id":"chi-1167","annotator_id":"chi-1167-b","annotation_status":"COMPLETE","source":{"base_sha":"77074b34b9396eed9faf73c2a484c775356b33ba","head_sha":"4af82b0226f4e63d58f10d149fbf2374d2140923","repository_access_mode":"FROZEN_REPOSITORY_READ_ONLY"},"findings":[],"missing_context_requests":[],"review_summary":"Completed the frozen base-to-head review. The PR only replaces interface{} with its predeclared alias any across production code and tests. This is type-identical in the repository's declared Go 1.24 language version, and the diff introduces no supported behavioral, API-compatibility, security, or robustness issue."}