{"case_id":"requests-7025","annotator_id":"requests-7025-a","annotation_status":"COMPLETE","source":{"base_sha":"1c49660b84c88eeb2695796ce4a68903c00e00c5","head_sha":"7d8df1df573a01f20a80994685e9f6c375f9c63f","repository_access_mode":"FROZEN_REPOSITORY_READ_ONLY"},"findings":[],"missing_context_requests":[],"review_summary":"Reviewed the complete base-to-head diff. The PR only updates the pinned pypa/gh-action-pypi-publish action from 1.12.4 to 1.13.0; the surrounding workflow supplies the required distribution path and OIDC permission. No repository-grounded issue was sufficiently supported."}