{"case_id":"flask-6096","annotator_id":"flask-6096-b","annotation_status":"COMPLETE","source":{"base_sha":"514fc6b3e8402e4c646d5284e97a4f0ab50a7c4b","head_sha":"7203feabf723edae0286ae5dc64fec8ac4c91735","repository_access_mode":"FROZEN_REPOSITORY_READ_ONLY"},"findings":[],"missing_context_requests":[],"review_summary":"Reviewed the complete four-file diff and surrounding Flask application, test-client, configuration, and test code. The changes consistently use URL parsing to handle bracketed IPv6 hosts while preserving hostname, port-override, zero-port, and cookie-domain behavior. The added tests cover both affected paths. No sufficiently supported PR-relevant issue was found. Targeted tests could not be executed because pytest is not installed, but the repository evidence was sufficient to complete the review."}