{"case_id":"flask-6096","annotator_id":"flask-6096-a","annotation_status":"COMPLETE","source":{"base_sha":"514fc6b3e8402e4c646d5284e97a4f0ab50a7c4b","head_sha":"7203feabf723edae0286ae5dc64fec8ac4c91735","repository_access_mode":"FROZEN_REPOSITORY_READ_ONLY"},"findings":[],"missing_context_requests":[],"review_summary":"Completed an independent review of the frozen base-to-head diff. The change consistently replaces colon-based host parsing with URL parsing for IPv6 compatibility in development-server configuration and test-client session cookie handling, with focused regression coverage. No sufficiently supported PR-introduced issue was found."}