{"case_id":"pytest-15044","annotator_id":"pytest-15044-b","annotation_status":"COMPLETE","source":{"base_sha":"99ab2acccff15f757260a1e1fbb0d2a47fc01041","head_sha":"f36ef6fe1d735aca4c033303c067db037d4aaf22","repository_access_mode":"FROZEN_REPOSITORY_READ_ONLY"},"findings":[],"missing_context_requests":[],"review_summary":"Completed a repository-grounded review of the exact base-to-head diff. The change replaces the manually managed cache file with Path.write_text so OSError failures during opening, writing, or closing are handled by the existing PytestCacheWarning path, and adds focused coverage for all three failure stages. No sufficiently supported technical issue was found. Tests were not executed because the mandated read-only environment does not permit their temporary filesystem writes."}