{"case_id":"flask-6133","annotator_id":"flask-6133-b","annotation_status":"COMPLETE","source":{"base_sha":"3596b1ab61cea85edb8970e83ff61daa073facf8","head_sha":"89992954ec71b594b1b911f98977cdc8ad46a057","repository_access_mode":"FROZEN_REPOSITORY_READ_ONLY"},"findings":[],"missing_context_requests":[],"review_summary":"Completed a read-only review of the exact base-to-head diff and relevant routing, blueprint inheritance, test-client, documentation, and class-based-view context. The new query decorator consistently delegates to the existing method-route mechanism with QUERY, and the added test exercises registration and dispatch. No sufficiently supported technical issue was found. Runtime tests could not be executed because pytest is unavailable, but the repository evidence was sufficient to complete the review."}