{"case_id":"pytest-15044","annotator_id":"pytest-15044-a","annotation_status":"COMPLETE","source":{"base_sha":"99ab2acccff15f757260a1e1fbb0d2a47fc01041","head_sha":"f36ef6fe1d735aca4c033303c067db037d4aaf22","repository_access_mode":"FROZEN_REPOSITORY_READ_ONLY"},"findings":[],"missing_context_requests":[],"review_summary":"Reviewed the complete base-to-head diff and relevant cache-provider implementation and tests. Replacing the manual open/write context manager with Path.write_text preserves successful-write behavior while allowing OSError from opening, writing, or closing to reach the existing PytestCacheWarning handler; the added tests cover those three failure stages. No sufficiently supported technical issue was found."}