{"case_id":"pytest-15057","annotator_id":"pytest-15057-b","annotation_status":"COMPLETE","source":{"base_sha":"56a92c19d4a71152c594726efc9deb5f0e126e99","head_sha":"2ba72a3a5e79e14ae477009987710f24060e69a1","repository_access_mode":"FROZEN_REPOSITORY_READ_ONLY"},"findings":[],"missing_context_requests":[],"review_summary":"Completed the frozen base-to-head review. The PR only removes obsolete location-based deduplication from `--fixtures`; fixture definitions are registered into mutually exclusive node-based or legacy nodeid-based maps, so the reviewed repository provides no supported path by which this removal creates duplicate output. No sufficiently supported issue was found."}