{"case_id":"flask-6133","annotator_id":"flask-6133-a","annotation_status":"COMPLETE","source":{"base_sha":"3596b1ab61cea85edb8970e83ff61daa073facf8","head_sha":"89992954ec71b594b1b911f98977cdc8ad46a057","repository_access_mode":"FROZEN_REPOSITORY_READ_ONLY"},"findings":[],"missing_context_requests":[],"review_summary":"Completed an independent review of the three-file commit-range diff. The new QUERY shortcut follows the existing method-specific decorator implementation, is exposed through the shared Scaffold API, and has focused routing coverage. No sufficiently supported technical issue was found. Runtime tests could not be executed because the frozen environment lacks the Werkzeug dependency, but the repository evidence was sufficient to complete the review."}