{"case_id":"httpx-3690","annotator_id":"httpx-3690-b","annotation_status":"COMPLETE","source":{"base_sha":"20380490fd0bd13c68704080754c1385bff96d69","head_sha":"350221558d4f079fc4ab3673d81a4bc730fbb9c3","repository_access_mode":"FROZEN_REPOSITORY_READ_ONLY"},"findings":[{"annotation_finding_id":"httpx-3690-b-001","issue_exists":true,"should_comment":true,"category":"error-handling-regression","path":"src/httpx/_server.py","start_line":111,"end_line":113,"severity":"low","evidence_refs":[{"path":"src/httpx/_server.py","start_line":111,"end_line":113,"revision":"350221558d4f079fc4ab3673d81a4bc730fbb9c3","description":"HTTPServer.wait now loops around sleep without handling KeyboardInterrupt."},{"path":"src/httpx/_server.py","start_line":111,"end_line":116,"revision":"20380490fd0bd13c68704080754c1385bff96d69","description":"The base implementation caught KeyboardInterrupt and broke out of the wait loop cleanly."},{"path":"src/httpx/_server.py","start_line":129,"end_line":133,"revision":"350221558d4f079fc4ab3673d81a4bc730fbb9c3","description":"The server advertises CTRL+C as its normal quit mechanism and run() directly calls server.wait()."}],"technical_rationale":"Removing the KeyboardInterrupt handler changes the synchronous run() shutdown path: pressing CTRL+C still unwinds the server context, but KeyboardInterrupt now escapes run() and ordinarily produces an exception traceback instead of returning normally. This is an unrelated user-visible regression in the same PR, not part of the clean client-disconnect fix.","comment_usefulness_rationale":"A comment is actionable because the prior try/except can be retained while the parser readiness changes remain intact, preserving the documented interactive shutdown behavior."}],"missing_context_requests":[],"review_summary":"The parser readiness change is internally consistent across synchronous and asynchronous implementations and addresses clean disconnects before a request starts. One separate low-severity regression was found: the synchronous server no longer absorbs CTRL+C in its documented wait path. Local tests could not be executed because pytest is not installed, but the finding follows deterministically from the base/head control flow."}