{"case_id":"httpx-3690","annotator_id":"httpx-3690-a","annotation_status":"COMPLETE","source":{"base_sha":"20380490fd0bd13c68704080754c1385bff96d69","head_sha":"350221558d4f079fc4ab3673d81a4bc730fbb9c3","repository_access_mode":"FROZEN_REPOSITORY_READ_ONLY"},"findings":[{"annotation_finding_id":"httpx-3690-a-f1","issue_exists":true,"should_comment":true,"category":"error-handling","path":"src/httpx/_server.py","start_line":111,"end_line":113,"severity":"low","evidence_refs":[{"path":"src/httpx/_server.py","start_line":111,"end_line":113,"revision":"350221558d4f079fc4ab3673d81a4bc730fbb9c3","description":"HTTPServer.wait now loops around sleep without handling KeyboardInterrupt."},{"path":"src/httpx/_server.py","start_line":103,"end_line":108,"revision":"20380490fd0bd13c68704080754c1385bff96d69","description":"The base implementation caught KeyboardInterrupt and exited the wait loop cleanly."},{"path":"src/httpx/_server.py","start_line":128,"end_line":137,"revision":"350221558d4f079fc4ab3673d81a4bc730fbb9c3","description":"The public run path advertises Ctrl+C shutdown and directly calls HTTPServer.wait."}],"technical_rationale":"This unrelated removal changes the documented synchronous server shutdown path: pressing Ctrl+C now lets KeyboardInterrupt escape from HTTPServer.wait and httpx.run instead of returning normally. Context-manager cleanup still runs, but normal interactive termination can now surface an exception/traceback to callers and scripts.","comment_usefulness_rationale":"A comment is useful because restoring the small KeyboardInterrupt guard preserves the existing public shutdown behavior without affecting the parser readiness fix."}],"missing_context_requests":[],"review_summary":"Reviewed the exact base-to-head diff locally. The parser readiness additions preserve buffered data and correctly distinguish EOF, but the same change also introduces one supported low-severity regression in synchronous Ctrl+C shutdown behavior."}