{"case_id":"chi-1167","annotator_id":"chi-1167-a","annotation_status":"COMPLETE","source":{"base_sha":"77074b34b9396eed9faf73c2a484c775356b33ba","head_sha":"4af82b0226f4e63d58f10d149fbf2374d2140923","repository_access_mode":"FROZEN_REPOSITORY_READ_ONLY"},"findings":[],"missing_context_requests":[],"review_summary":"Completed the frozen base-to-head review. The PR only replaces interface{} with its exact alias any across eight Go files. The module requires Go 1.24, where any is fully supported, and no behavioral or API-type change is introduced. No sufficiently supported technical issue was found. Tests could not be executed because the frozen environment has no Go executable, but the mechanical, semantics-preserving diff was fully inspectable."}